<?xml version="1.0" encoding="UTF-8"?>
<!DOCTYPE listacompras SYSTEM "ejer5.dtd">
<listacompras>
    <venta>
        <ventacredito>
            <cantidad>32 euros</cantidad>
        </ventacredito>
    </venta>
    <venta>
        <ventacredito>
            <fechaimpago> 23 de Marzo</fechaimpago>
            <cantidad>32</cantidad>
        </ventacredito>
    </venta>
    <venta>
        <ventainmediata>
            <cantidad>23</cantidad>
            <divisa>euros</divisa>
        </ventainmediata>
    </venta>
</listacompras>